{
  "irVersion": "1.2",
  "source": {
    "project": "01920000-0000-7000-8000-00000000c0b3",
    "ref": "v0.0.1",
    "immutable": true,
    "schemaHash": "sha256:609080a612867a5002542e5099e41dc4cd62e8d68f6c4cf2216944ef28efffc7"
  },
  "types": {
    "article": {
      "slug": "article",
      "name": "Article",
      "version": "01920000-0000-7000-8000-0000000000d1",
      "fields": [
        {
          "id": "title",
          "name": "title",
          "kind": "text",
          "presence": "always",
          "required": true,
          "localized": false,
          "sortable": false
        },
        {
          "id": "references",
          "name": "References",
          "kind": "repeater",
          "presence": "maybe",
          "required": false,
          "localized": false,
          "sortable": false,
          "of": [
            "citation"
          ],
          "max": 20
        },
        {
          "id": "sections",
          "name": "sections",
          "kind": "repeater",
          "presence": "always",
          "required": true,
          "localized": false,
          "sortable": false,
          "of": [
            "callout",
            "quote"
          ],
          "min": 1
        }
      ]
    }
  },
  "components": {
    "callout": {
      "slug": "callout",
      "name": "Callout",
      "version": "01920000-0000-7000-8000-0000000000d3",
      "fields": [
        {
          "id": "tone",
          "name": "tone",
          "kind": "choice",
          "presence": "always",
          "required": true,
          "localized": false,
          "sortable": false,
          "values": [
            "info",
            "warning"
          ]
        },
        {
          "id": "body",
          "name": "body",
          "kind": "longText",
          "presence": "always",
          "required": true,
          "localized": false,
          "sortable": false,
          "textFormat": "markdown"
        }
      ]
    },
    "citation": {
      "slug": "citation",
      "name": "Citation",
      "version": "01920000-0000-7000-8000-0000000000d2",
      "fields": [
        {
          "id": "authors",
          "name": "Authors",
          "kind": "text",
          "presence": "always",
          "required": true,
          "localized": false,
          "sortable": false
        },
        {
          "id": "year",
          "name": "Year",
          "kind": "integer",
          "presence": "always",
          "required": true,
          "localized": false,
          "sortable": false,
          "min": 1000,
          "max": 2100
        },
        {
          "id": "title",
          "name": "Title",
          "kind": "text",
          "presence": "always",
          "required": true,
          "localized": false,
          "sortable": false
        },
        {
          "id": "source",
          "name": "Journal or publisher",
          "kind": "text",
          "presence": "maybe",
          "required": false,
          "localized": false,
          "sortable": false
        },
        {
          "id": "url",
          "name": "DOI or URL",
          "kind": "text",
          "presence": "maybe",
          "required": false,
          "localized": false,
          "sortable": false
        }
      ]
    },
    "quote": {
      "slug": "quote",
      "name": "Quote",
      "version": "01920000-0000-7000-8000-0000000000d4",
      "fields": [
        {
          "id": "text",
          "name": "text",
          "kind": "longText",
          "presence": "always",
          "required": true,
          "localized": false,
          "sortable": false,
          "textFormat": "plain"
        },
        {
          "id": "attribution",
          "name": "attribution",
          "kind": "text",
          "presence": "maybe",
          "required": false,
          "localized": false,
          "sortable": false
        },
        {
          "id": "rating",
          "name": "rating",
          "kind": "number",
          "presence": "maybe",
          "required": false,
          "localized": false,
          "sortable": false
        }
      ]
    }
  },
  "warnings": [
    {
      "type": "article",
      "field": "sections",
      "message": "holds component type 'videoBlock', which is not on this ref"
    }
  ]
}
